platforms/sputnik/reports/universal-0.2.0/summary.csv

run,profile,scenario,status,altitude_error,max_tilt,final_speed,max_error,peak_horizontal_speed,max_horizontal_displacement,max_yaw,tail_speed_rms,cruise_pitch_mean,cruise_pitch_std,first_fault
profile-1,1,hover,PASS,2.494231750347353E-4,0.0,0.0017381490055871102,0.001361498441710296,5.952742263584449E-15,1.728324323475134E-13,2.4660336231929434E-32,0.002132225375125873,0.0,0.0,
profile-1,1,altitude,PASS,4.601848419838461E-5,0.0,0.0014355186625812308,1.0002339161710694,5.4394144753365E-15,1.372663032178115E-13,9.885722066633362E-32,0.0022391252749217987,0.0,0.0,
profile-1,1,forward,PASS,7.303780320455644E-5,8.36684640644254,0.009424113649846976,0.21408161296665185,2.2684736793773177,4.504061682070743,0.00841721302519674,0.009817810544702932,0.0,0.0,
profile-1,1,reverse,PASS,3.827384846459836E-4,8.36684140774216,0.010401179990778223,0.21408148579139663,2.2684734031737843,4.5040442750069385,0.004336168291021628,0.015026078599548543,0.0,0.0,
profile-1,1,turn,PASS,0.0013908812520639913,7.94468417893679,0.012491781347501379,0.19063276167879906,2.186839550638414,4.395036224839174,2.2435236262194618,0.010922420577818611,0.0,0.0,
profile-1,1,mass,PASS,6.163762803197415E-4,0.0,0.003257089176105499,0.16762518452148356,4.212859831201121E-15,1.4367053585960226E-13,1.4170243982616557E-32,0.0023864489865793475,0.0,0.0,
profile-1,1,calibration,PASS,2.9085695300068437E-4,4.230669860235763,0.02141913674745642,0.6146382184448527,0.7632780529710005,1.2980348935850565,0.05306671431755364,0.013801572000346787,0.0,0.0,
profile-1,1,mission,PASS,0.0012271636053355905,5.354136573972072,0.013720780941278972,1.2283088290809303,1.294313469681347,2.9453646917479706,0.044168306246964974,0.007877155931304166,0.0,0.0,
profile-1,1,mission_straight,PASS,1.6421292629331674E-4,6.731161609513243,0.004664525013737191,1.2428600119371822,1.3063914491320967,5.912777373657725,0.049432809178051894,0.013738047113612963,0.0,0.0,
profile-1,1,cruise,PASS,0.0011168251983804112,9.182775707424437,0.01565358651296305,0.1636996430898563,7.572776541726545,128.59407153737345,0.013124775549832185,0.00800356561227746,8.001050329363688,0.02418990383541335,
profile-2,2,hover,PASS,0.0,0.0,0.0,0.0,0.0,0.0,0.0,0.0,0.0,0.0,
profile-2,2,altitude,PASS,6.233968266116108E-4,0.0,0.012917667242965442,1.0,0.0,0.0,0.0,0.009292411101761737,0.0,0.0,
profile-2,2,forward,PASS,0.0,0.0,0.009117692772468865,0.0,2.0741902207168175,6.233701068727786,0.0,0.008232981778813908,0.0,0.0,
profile-2,2,reverse,PASS,0.0,0.0,0.008907637774536889,0.0,1.97860253871275,5.766554117308567,0.0,0.008208679585210142,0.0,0.0,
profile-2,2,turn,PASS,0.0,0.0,0.004074346537128619,0.0,1.9785494912158836,6.381445860977974,18.539648061692425,0.00818736371190825,0.0,0.0,
profile-2,2,mass,PASS,5.26820816148188E-4,0.0,9.914499105029499E-4,0.2301965449723582,0.0,0.0,0.0,0.0024528042923853952,0.0,0.0,
profile-2,2,calibration,PASS,0.003267114009247507,0.0,0.012030514603742114,0.5621499963664576,1.2917855571745658,3.2656910429920534,5.1105515570738715,0.010015297897022803,0.0,0.0,
profile-2,2,mission,FAIL,1.0019250867373017,0.0,0.01426784267519913,1.1242717713749641,1.2917855571745658,3.726395346432178,179.77684078548648,0.012308268850205736,0.0,0.0,
profile-2,2,mission_straight,PASS,0.004463223386238724,0.0,0.010273205459792571,1.1242717713749641,1.2917855571745658,5.914846457835302,99.19905231585251,0.010472809488873396,0.0,0.0,
profile-2,2,cruise,PASS,0.0,0.0,0.010488289835453992,0.0,7.46274055527692,127.99874771885179,0.0,0.008238577178950058,0.0,0.0,
profile-3,3,hover,PASS,2.494231750347353E-4,0.0,0.0017381490055871102,0.001361498441710296,5.952742263584449E-15,1.728324323475134E-13,2.4660336231929434E-32,0.002132225375125873,0.0,0.0,
profile-3,3,altitude,PASS,4.601848419838461E-5,0.0,0.0014355186625812308,1.0002339161710694,5.4394144753365E-15,1.372663032178115E-13,9.885722066633362E-32,0.0022391252749217987,0.0,0.0,
profile-3,3,forward,PASS,2.494231750347353E-4,0.0,0.03747028866158761,0.001361498441710296,1.5590751104590022,4.241078427746431,6.0651287923832405E-33,0.029871683468708613,0.0,0.0,
profile-3,3,reverse,PASS,2.494231750347353E-4,0.0,0.032645283881654476,0.001361498441710296,1.4916244150785962,3.956546509865178,2.66760563503788E-32,0.030125077784679825,0.0,0.0,
profile-3,3,turn,PASS,2.494231750347353E-4,0.0,0.029433400747736663,0.001361498441710296,1.484258326541386,4.276425818142549,18.00586929153514,0.029613634456413334,0.0,0.0,
profile-3,3,mass,PASS,6.163762803197415E-4,0.0,0.003257089176105499,0.16762518452148356,4.212859831201121E-15,1.4367053585960226E-13,1.4170243982616557E-32,0.0023864489865793475,0.0,0.0,
profile-3,3,calibration,PASS,1.2415776511431886E-4,0.14723892983133124,0.009135320660754238,0.6155531888124415,0.3761618760116657,0.9516241127993601,9.16807192504613,0.029874678646285787,0.0,0.0,
profile-3,3,mission,PASS,2.188836695182772E-4,0.14723892983133124,0.03857703751553194,1.2321420973787838,0.5379834407455882,2.745015250228938,12.281661208972324,0.030143224134233815,0.0,0.0,
profile-3,3,mission_straight,PASS,2.773889796117146E-4,0.14723892983133124,0.03444161110645182,1.2321425657839882,0.8166894809847645,5.870954034613674,9.16807192504613,0.02961467803184662,0.0,0.0,
profile-3,3,cruise,PASS,2.494231750347353E-4,0.0,0.037445031666036965,0.001361498441710296,7.014613868548699,111.69361567316037,6.957398768692439E-32,0.029783384388317225,-1.9862726451599985E-15,4.025323924967537E-16,
profile-4,4,hover,PASS,0.006306722469716419,0.0,0.011173633997804338,0.006306722469716419,0.0,0.0,0.0,0.007407187455932958,0.0,0.0,
profile-4,4,altitude,PASS,0.0011886427048324322,0.0,0.00365637591905469,0.9953835719617246,0.0,0.0,0.0,0.0076896835748690145,0.0,0.0,
profile-4,4,forward,PASS,0.006306722469716419,0.0,0.01442166658122383,0.006306722469716419,2.074197453531926,6.233715778484565,0.0,0.011074667054505157,0.0,0.0,
profile-4,4,reverse,PASS,0.006306722469716419,0.0,0.014289748324918913,0.006306722469716419,1.9786104826915027,5.766574977952676,0.0,0.011056616467932656,0.0,0.0,
profile-4,4,turn,PASS,0.006306722469716419,0.0,0.011892468506003426,0.006306722469716419,1.97851177292392,6.384102226369825,18.020171645798882,0.011038528929373154,0.0,0.0,
profile-4,4,mass,PASS,2.9716494830722695E-4,0.0,0.022553737243654497,0.20308547232049534,0.0,0.0,0.0,0.012708029027791952,0.0,0.0,
profile-4,4,calibration,PASS,0.009036079074192571,0.0,0.011117613676431897,0.6562125376083685,0.448426777036347,1.0270776653686067,9.857307307814889,0.012211223865662693,0.0,0.0,
profile-4,4,mission,PASS,0.002907127370519902,0.0,0.013104832458787104,1.2946940939676779,0.6894392870507956,2.91015419738108,9.857307307814889,0.012909381629494721,0.0,0.0,
profile-4,4,mission_straight,PASS,0.0011656795263803588,0.0,0.006309133031203156,1.2946940939676779,0.9064838041977564,5.8588074045747485,9.857307307814889,0.010712534424506539,0.0,0.0,
profile-4,4,cruise,PASS,0.006306722469716419,0.0,0.01440205969584145,0.006306722469716419,7.462726893948124,127.99882765650214,0.0,0.01105648429083163,0.0,0.0,
profile-5,5,hover,PASS,0.044145568933601,1.1558920217703146,0.03953364496446541,0.24985340151091862,0.09831156776263697,0.10781234973066083,0.06350636852276544,0.1292818620853851,0.0,0.0,
profile-5,5,altitude,PASS,0.030686785978915054,3.3844921534494805,0.26308286308847006,1.2366740068397348,0.2019527653367939,0.3043328680533862,0.22532253291006726,0.16341553110345503,0.0,0.0,
profile-5,5,forward,PASS,0.012977298879334853,12.54839501196503,0.14501202113062076,1.3196557577212928,2.651177878002333,5.899001055733251,0.09188444633346551,0.1781919649779131,0.0,0.0,
profile-5,5,reverse,PASS,0.10620008996808394,15.208377780696086,0.04976316824347695,2.122963967137153,2.879300413369921,6.460325773896934,1.9203954755450163,0.16850059049688856,0.0,0.0,
profile-5,5,turn,PASS,0.059838052113448725,12.030468800875209,0.24344288241228376,1.038715447371402,2.396435615509079,5.077461206786216,3.5424162875891114,0.1529672299580428,0.0,0.0,
profile-5,5,mass,PASS,0.2291211876009811,3.2968813145558036,0.1798946738110022,0.450311965973512,0.2249287146127624,0.4806128183229997,0.1174589434733731,0.2811515667362048,0.0,0.0,
profile-5,5,calibration,PASS,0.1563249058164331,4.976829474040859,0.026143526261441518,0.6844087642474932,0.8207929836679537,1.51314841516297,0.37824370883176583,0.15594558480726273,0.0,0.0,
profile-5,5,mission,PASS,0.007849383674368937,10.781527562357597,0.03674754134880605,1.855067735587781,1.3220944418238454,3.1122382128579424,0.6018724791666848,0.15401485757607253,0.0,0.0,
profile-5,5,mission_straight,PASS,0.015245600160156414,10.486566662788176,0.1857228436484068,1.692868623011563,1.3043193469346683,6.170204411212605,0.5605253889058162,0.144186604287252,0.0,0.0,
profile-5,5,cruise,PASS,0.16801033033270585,14.555701168052288,0.11753222834379203,0.8229319888986311,7.554932052378175,129.82304331036133,0.6005367158251074,0.16272892487790444,7.923080872964445,0.1145964248680932,
low-inertia-delay,1,hover,PASS,0.00921207494683074,0.3817520331419327,0.007127243871519773,0.017202432054432393,0.03250124149103742,0.030219989762218232,0.0022574799145350117,0.012946561559117402,0.0,0.0,
low-inertia-delay,1,forward,PASS,0.005913231641542893,13.511608424287527,0.015259638023600064,0.3267469261836453,2.6945462228571015,5.574844092430026,0.069007013614862,0.01309567474988288,0.0,0.0,
low-inertia-delay,1,mass,PASS,0.004014711546631133,0.3431546690850362,0.015125027003045344,0.19718166885961352,0.025554116934622294,0.030144841312482715,0.0072240751703138446,0.011205030968051352,0.0,0.0,
low-inertia-delay,5,hover,FAIL,2.2666896304825315,25.978916757798235,1.8322209581060933,11.499186679667886,3.7820920712281776,22.808252605263142,9.88979841983471,2.3556933130719226,0.0,0.0,
low-inertia-delay,5,forward,FAIL,11.2880020833028,23.496527609183627,1.845928508898503,11.2880020833028,3.20027617486458,11.7158894995047,4.871858488830977,1.820581105180054,0.0,0.0,
low-inertia-delay,5,mass,FAIL,12.279094093307478,25.764432648636518,1.8018083024638514,12.62671486190004,3.0287012590750275,17.647141114531784,36.10407894062789,1.9776053513354146,0.0,0.0,
offset-weak-rotor,1,hover,FAIL,4.8809994697762704E-4,5.754208099189503,0.7888177133168954,0.5302132668660846,1.0344373381218466,43.143683351589836,0.6560251363753224,0.7929484747145186,0.0,0.0,
offset-weak-rotor,1,forward,FAIL,0.014687192415550498,12.366167024852713,0.796424286362325,0.6403238029602818,4.158897006290429,53.54504703884001,2.059326169043204,0.7936470094179767,0.0,0.0,
offset-weak-rotor,1,mass,PASS,0.02070738661792859,5.754208099189503,0.023928416850578255,0.5302132668660846,1.0344373381218466,7.3518977976516435,0.7021593354478357,0.03330296985568763,0.0,0.0,
offset-weak-rotor,5,hover,FAIL,0.1870117910557667,3.997240384471376,0.30528018033922333,0.81444950260952,0.44718123699932866,16.353379083758426,0.24366259576748608,0.3697189473922209,0.0,0.0,
offset-weak-rotor,5,forward,FAIL,0.06412934010047877,12.383219958692388,0.34624874890441537,2.5201148800721427,2.849735222926672,16.919482497184067,1.5151096753322673,0.3890155741424542,0.0,0.0,
offset-weak-rotor,5,mass,PASS,0.19466350043801128,4.272425839995673,0.22008248632441915,0.851620140998989,0.44718123699932866,4.29850070027949,0.6840276686571529,0.3471785307907928,0.0,0.0,
mass-damage,1,damage,PASS,0.009201391731650688,5.062922657656091,0.05375524249492168,0.4939035464769006,0.8324175307383272,3.6488926360858005,0.4761632668965192,0.0407167465254968,0.0,0.0,
mass-damage,5,damage,PASS,0.25766646751243627,3.361071853203717,0.14911771474543262,0.6193813891490123,0.33154647628773404,2.530964037152351,0.7139642906515457,0.34833871339892036,0.0,0.0,

platforms/sputnik/reports/universal-0.2.0/README.md

## Échecs conservés

- profile-2 / mission : FAIL ; erreur finale hauteur 1.002 m, inclinaison maximale 0.00°, vitesse finale 0.014 m/s.
- low-inertia-delay / hover : FAIL ; erreur finale hauteur 2.267 m, inclinaison maximale 25.98°, vitesse finale 1.832 m/s.
- low-inertia-delay / forward : FAIL ; erreur finale hauteur 11.288 m, inclinaison maximale 23.50°, vitesse finale 1.846 m/s.
- low-inertia-delay / mass : FAIL ; erreur finale hauteur 12.279 m, inclinaison maximale 25.76°, vitesse finale 1.802 m/s.
- offset-weak-rotor / hover : FAIL ; erreur finale hauteur 0.000 m, inclinaison maximale 5.75°, vitesse finale 0.789 m/s.
- offset-weak-rotor / forward : FAIL ; erreur finale hauteur 0.015 m, inclinaison maximale 12.37°, vitesse finale 0.796 m/s.
- offset-weak-rotor / hover : FAIL ; erreur finale hauteur 0.187 m, inclinaison maximale 4.00°, vitesse finale 0.305 m/s.
- offset-weak-rotor / forward : FAIL ; erreur finale hauteur 0.064 m, inclinaison maximale 12.38°, vitesse finale 0.346 m/s.